currentId,title,overview,genres,runtime,releaseDate,posterPath
4571,Shadow Conspiracy,"Bobby Bishop (Sheen) is a special assistant to the President of the United States. Accidentally, he meets his friend professor Pochenko on the street. Pochenko has time to tell Bishop about some conspiracy in the White House but then immediately gets killed by an assassin. Now bad guys are after Bobby as the only man who knows about a plot. Bishop must now not only survive, but to stop the conspirators from achieving their goal. And he doesn't know whom to trust.","Action, Thriller",103.0,1997-01-31,https://flixpatrol.com/runtime/cache/files/posters/g/w350/w1MCRsbCAIdOTobSmoU9KIEvZKF.jpg
4621,Jude,"In late 19th-century England, Jude aspires to be an academic, but is hobbled by his blue-collar background. Instead, he works as a stonemason and is trapped in an unloving marriage to a farmer's daughter named Arabella. But when his wife leaves him, Jude sees an opportunity to improve himself. He moves to the city and begins an affair with his married cousin, Sue, courting tragedy every step of the way.","Drama, Romance",123.0,1996-02-06,https://flixpatrol.com/runtime/cache/files/posters/g/w350/2OA9M8KribkctpSRDAlPu6yWOx8.jpg
4623,Everyone Says I Love You,A New York girl sets her father up with a beautiful woman in a shaky marriage while her half sister gets engaged.,"Music, Comedy, Romance",101.0,1996-12-06,https://flixpatrol.com/runtime/cache/files/posters/g/w350/eCw5qDE5Jw1B9Cuzs8DJD4uwaZV.jpg
4638,Bitter Sugar,A patriot (René Lavan) with a rebellious brother falls in love with a dissident's daughter (Mayte Vilán) in Castro's Cuba.,"Drama, Romance",102.0,1996-02-10,https://flixpatrol.com/runtime/cache/files/posters/g/w350/r8t3br5OGnvyILuzEWIgvbWwqkc.jpg
4641,Sleepers,Two gangsters seek revenge on the state jail worker who during their stay at a youth prison sexually abused them. A sensational court hearing takes place to charge him for the crimes. A moving drama from director Barry Levinson.,"Crime, Drama, Thriller",147.0,1996-10-18,https://flixpatrol.com/runtime/cache/files/posters/g/w350/cDqEv4Fw4JZh2zCfecqw3z09L8z.jpg
4654,Aladdin and the King of Thieves,"Legendary secrets are revealed as Aladdin and his friends—Jasmine, Abu, Carpet and, of course, the always entertaining Genie—face all sorts of terrifying threats and make some exciting last-minute escapes pursuing the King Of Thieves and his villainous crew.","Adventure, Animation, Family",81.0,1996-05-20,https://flixpatrol.com/runtime/cache/files/posters/g/w350/f6cwFA76j6aaRu1KOQ8bBYfSlLx.jpg
4658,The Woman in Question,"Director Anthony Asquith, working in the style of a Hitchcock whodunit, deftly moves between multiple points of view in this gritty look at life in a seaport town. Jean Kent stars as Agnes ""Astra"" Huston, a fortune teller at a run-down fair, who is found strangled in her bedroom. As the police question five suspects their interactions with her are shown in flashbacks from their point of view.",Mystery,88.0,1952-02-18,https://flixpatrol.com/runtime/cache/files/posters/g/w350/vN4bkACDLO3foJynEcTyJfOTvmJ.jpg
4678,Crossfire,"A man is murdered, apparently by one of a group of soldiers just out of the army. But which one? And why?","Crime, Drama, Mystery, Thriller",86.0,1947-07-22,https://flixpatrol.com/runtime/cache/files/posters/g/w350/bF2FY0FiUf3daJxuowDKtimN1P9.jpg
4713,Willy Wonka & the Chocolate Factory,Eccentric candy man Willy Wonka prompts a worldwide frenzy when he announces that golden tickets hidden inside five of his delicious candy bars will admit their lucky holders into his top-secret confectionary. But does Wonka have an agenda hidden amid a world of Oompa Loompas and chocolate rivers?,"Family, Fantasy",100.0,1971-06-29,https://flixpatrol.com/runtime/cache/files/posters/g/w350/b94qXd1FcIwgzv0NYMUe2bjrzJR.jpg
4719,Sleeper,"Miles Monroe, a clarinet-playing health food store proprietor, is revived out of cryostasis 200 years into a future world in order to help rebels fight an oppressive government regime.","Comedy, Romance",89.0,1973-12-17,https://flixpatrol.com/runtime/cache/files/posters/g/w350/fna6VsLR1EX3cF29Pk2FYZkfsBv.jpg
4731,The Great Race,"Professional daredevil and white-suited hero, The Great Leslie, convinces turn-of-the-century auto makers that a race from New York to Paris (westward across America, the Bering Straight and Russia) will help to promote automobile sales. Leslie's arch-rival, the mustached and black-attired Professor Fate vows to beat Leslie to the finish line in a car of Fate's own invention.","Adventure, Comedy",160.0,1965-07-01,https://flixpatrol.com/runtime/cache/files/posters/g/w350/nc6FRAVC4a8o4podiFy2P5qI9ul.jpg
4738,Dial M for Murder,"An ex-tennis pro carries out a plot to have his wife murdered after discovering she is having an affair, and assumes she will soon leave him for the other man anyway. When things go wrong, he improvises a new plan - to frame her for murder instead.","Crime, Mystery, Thriller",104.0,1954-05-29,https://flixpatrol.com/runtime/cache/files/posters/g/w350/xrpK1PyckNWmRxU4kZURfaCyboS.jpg
4744,Madame Butterfly,"Cio-Cio-San, a young Japanese geisha, seeks to fulfill her dreams through marriage to an American naval officer. Her faith in their future is shattered by his empty vows and the loss she endures touches something deep within us all.","Action, Adventure, Crime, Mystery, Thriller",135.0,1995-11-22,https://flixpatrol.com/runtime/cache/files/posters/g/w350/uHKRkE0jOVQ6lnANqp1mWEDsro4.jpg
4816,Platoon,"As a young and naive recruit in Vietnam, Chris Taylor faces a moral crisis when confronted with the horrors of war and the duality of man.","Drama, War, Action",120.0,1986-12-18,https://flixpatrol.com/runtime/cache/files/posters/g/w350/sYPOQI57JVNmjiLI3KeZ5KA8O9i.jpg
4823,Weekend at Bernie's,"Two friends are invited for a weekend to a luxury island with their boss. The boss gets shot and nobody seems to notice, except for the two friends. In order not to become suspects of murder they treat the body as a puppet and make people believe he's still alive. The killer wants to do his job so when he is informed that the stiff is still alive he's got to shoot him again, and again, and again.",Comedy,97.0,1989-07-05,https://flixpatrol.com/runtime/cache/files/posters/g/w350/h3hjMREZEUPtDkZBiYDzLq0THk0.jpg
4844,Basic Instinct,"A police detective is in charge of the investigation of a brutal murder, in which a beautiful and seductive woman could be involved.","Thriller, Mystery",127.0,1992-03-20,https://flixpatrol.com/runtime/cache/files/posters/g/w350/p1DHOfLFZmM567ePKfFNMV4mY92.jpg
4848,The Doors,"The story of the famous and influential 1960's rock band and its lead singer and composer, Jim Morrison.","Drama, Music",140.0,1991-03-01,https://flixpatrol.com/runtime/cache/files/posters/g/w350/9CkFrWAkg23YynYd2uJLyWznMZZ.jpg
4873,The Crying Game,"Irish Republican Army member Fergus (Stephen Rea) forms an unexpected bond with Jody (Forest Whitaker), a kidnapped British soldier in his custody, despite the warnings of fellow IRA members Jude (Miranda Richardson) and Maguire (Adrian Dunbar). Jody makes Fergus promise he'll visit his girlfriend, Dil (Jaye Davidson), in London, and when Fergus flees to the city, he seeks her out. Hounded by his former IRA colleagues, he finds himself increasingly drawn to the enigmatic, and surprising, Dil.","Romance, Crime, Drama, Thriller",112.0,1992-09-02,https://flixpatrol.com/runtime/cache/files/posters/g/w350/9Qqk3svM0I9QuabOPDNrJZdv3XJ.jpg
4878,Glengarry Glen Ross,"Glengarry Glen Ross, follows the lives of four unethical Chicago real estate agents who are prepared to go to any lengths (legal or illegal) to unload undesirable real estate on unwilling prospective buyers.","Crime, Drama, Mystery",100.0,1992-09-15,https://flixpatrol.com/runtime/cache/files/posters/g/w350/4YgCTLcHEIeGyzrKpwz93rORb8l.jpg
4881,Sophie's Choice,"Meryl Streep stars as Sophie, a Polish immigrant who shares a boarding house in Brooklyn with her tempestuous lover, Nathan (Kevin Kline in his feature film debut), and a young writer, Stingo (Peter MacNicol).","Drama, Romance",151.0,1982-12-08,https://flixpatrol.com/runtime/cache/files/posters/g/w350/7kBisRhUVzL09qSdNFeg33XbL1N.jpg
4886,E.T. the Extra-Terrestrial,"After a gentle alien becomes stranded on Earth, the being is discovered and befriended by a young boy named Elliott. Bringing the extraterrestrial into his suburban California house, Elliott introduces E.T., as the alien is dubbed, to his brother and his little sister, Gertie, and the children decide to keep its existence a secret. Soon, however, E.T. falls ill, resulting in government intervention and a dire situation for both Elliott and the alien.","Adventure, Family, Fantasy",115.0,1982-04-03,https://flixpatrol.com/runtime/cache/files/posters/g/w350/8htLKK03TJjKZOXJgihZCu8v0P.jpg
4890,Days of Thunder,"Talented but unproven stock car driver Cole Trickle gets a break and with the guidance of veteran Harry Hogge turns heads on the track. The young hotshot develops a rivalry with a fellow racer that threatens his career when the two smash their cars. But with the help of his doctor, Cole just might overcome his injuries-- and his fear.",Adventure,107.0,1990-06-27,https://flixpatrol.com/runtime/cache/files/posters/g/w350/jNw4mKvTW3lSDOv9Ruiph6EQqXj.jpg
4896,Top Gun,"For Lieutenant Pete 'Maverick' Mitchell and his friend and Co-Pilot Nick 'Goose' Bradshaw being accepted into an elite training school for fighter pilots is a dream come true.  A tragedy, as well as personal demons, threaten Pete's dreams of becoming an Ace pilot.","Action, Romance, War",110.0,1986-05-16,https://flixpatrol.com/runtime/cache/files/posters/g/w350/orGXnBKfT41LxZhitLkXhqUfJJW.jpg
4902,Rebel Without a Cause,"After moving to a new town, troublemaking teen Jim Stark is supposed to have a clean slate, although being the new kid in town brings its own problems. While searching for some stability, Stark forms a bond with a disturbed classmate, Plato, and falls for local girl Judy. However, Judy is the girlfriend of neighborhood tough, Buzz. When Buzz violently confronts Jim and challenges him to a drag race, the new kid's real troubles begin.",Drama,111.0,1955-10-27,https://flixpatrol.com/runtime/cache/files/posters/g/w350/bEAoNvtqvO0c2lItNkKlKUqhPuw.jpg
4992,A Single Girl,"A young Parisian must make major decisions about pregnancy, a job and her boyfriend.",Drama,90.0,1995-05-29,https://flixpatrol.com/runtime/cache/files/posters/g/w350/3XbpQPwm8Ch2KoTjPWSBZM9dFZy.jpg
5000,The People vs. Larry Flynt,"Larry Flynt is the hedonistically obnoxious, but indomitable, publisher of Hustler magazine. The film recounts his struggle to make an honest living publishing his girlie magazine and how it changes into a battle to protect the freedom of speech for all people.",Drama,129.0,1996-10-12,https://flixpatrol.com/runtime/cache/files/posters/g/w350/9F1eO4vH7yseGQEovIkXOm3Hrtq.jpg
5008,Glory Daze,"It's punk rock meets Animal House in this campus comedy that stars Ben Affleck as Jack, a soon-to-be graduate who finds he's having a difficult time letting go of the college life -- and decides maybe he doesn't have to. Also questioning whether there's life after college are Jack's roommates: Rob, who fears domestication; comic-strip artist Mickey, who's shy around girls; intellectual party animal Slosh; and perpetual student Dennis.",Comedy,100.0,1995-10-01,https://flixpatrol.com/runtime/cache/files/posters/g/w350/aZMYmtjim90B5ifnkHPUAVyfQ5L.jpg
5026,Drop Dead Fred,"When Elizabeth returns to her mother's home after her marriage breaks up, she recreates her imaginary childhood friend, Fred, to escape from the trauma of losing her husband and her job. In between the chaos and mayhem that Fred creates, Elizabeth attempts to win back her husband and return to normality.","Comedy, Fantasy, Family",103.0,1991-04-19,https://flixpatrol.com/runtime/cache/files/posters/g/w350/skRvltgHJXnFRMfZNOiID6o4UQn.jpg
5066,The Howling,"After a bizarre and near fatal encounter with a serial killer, a newswoman is sent to a rehabilitation center whose inhabitants may not be what they seem.","Drama, Horror",91.0,1981-04-03,https://flixpatrol.com/runtime/cache/files/posters/g/w350/zXiQCqtw5lZwrLDqRPbAJhT80Ri.jpg
5075,Private Benjamin,A sheltered young high society woman joins the army on a whim and finds herself in a more difficult situation than she ever expected.,Comedy,109.0,1980-10-06,https://flixpatrol.com/runtime/cache/files/posters/g/w350/prlM1orr542htKHpWEqCOngYLn6.jpg
5110,Monty Python and the Holy Grail,"King Arthur, accompanied by his squire, recruits his Knights of the Round Table, including Sir Bedevere the Wise, Sir Lancelot the Brave, Sir Robin the Not-Quite-So-Brave-As-Sir-Lancelot and Sir Galahad the Pure. On the way, Arthur battles the Black Knight who, despite having had all his limbs chopped off, insists he can still fight. They reach Camelot, but Arthur decides not  to enter, as ""it is a silly place"".","Adventure, Comedy, Fantasy",91.0,1975-03-13,https://flixpatrol.com/runtime/cache/files/posters/g/w350/jRx1nDUA4sb2NEKQaukXKBz6pCf.jpg
5222,When We Were Kings,"It's 1974. Muhammad Ali is 32 and thought by many to be past his prime. George Foreman is ten years younger and the heavyweight champion of the world. Promoter Don King wants to make a name for himself and offers both fighters five million dollars apiece to fight one another, and when they accept, King has only to come up with the money. He finds a willing backer in Mobutu Sese Suko, the dictator of Zaire, and the ""Rumble in the Jungle"" is set, including a musical festival featuring some of America's top black performers, like James Brown and B.B. King.",Documentary,89.0,1996-10-25,https://flixpatrol.com/runtime/cache/files/posters/g/w350/wAw3KIEuQGIwhCBWtvWFQRItz0d.jpg
5225,The Wrong Trousers,"Gromit finds himself being pushed out of his room and home by a new lodger who is actually a ruthless criminal (and a small penguin). The penguin is planning a robbery and needs to use Wallace and his mechanical remote controlled trousers to pull off the raid. However, Gromit is wise to the penguin and comes to the rescue.","Animation, Comedy, Family",30.0,1993-12-17,https://flixpatrol.com/runtime/cache/files/posters/g/w350/xT2NxRbqnTXYqoVQvKSmkLEm4lE.jpg
5283,The Children Are Watching Us,"The film follows a four-year old boy named Prico as he becomes the subject of emotional folly by his fluctuant parents and inattentive relatives.  In his first collaboration with renowned screenwriter and longtime partner Cesare Zavattini, Vittorio De Sica examines the cataclysmic consequences of adult folly on an innocent child. Heralding the pair’s subsequent work on some of the masterpieces of Italian neorealism, The Children Are Watching Us is a vivid, deeply humane portrait of a family’s disintegration.",Drama,84.0,1944-10-27,https://flixpatrol.com/runtime/cache/files/posters/g/w350/7MM31gnrGXB0VXMHOO9JmqlHQNC.jpg
5299,The Tin Drum,"Oskar Matzerath, son of a local dealer, is a most unusual boy. Equipped with full intellect right from his birth he decides at his third birthday not to grow up as he sees the crazy world around him at the eve of World War II. So he refuses the society and his tin drum symbolizes his protest against the middle-class mentality of his family and neighborhood, which stand for all passive people in Nazi Germany at that time. However, (almost) nobody listens to him, so the catastrophe goes on...","Drama, History, War",142.0,1979-05-02,https://flixpatrol.com/runtime/cache/files/posters/g/w350/bHKwTyB7iAsXt0EpZN1iNA34bPs.jpg
5308,The Ruling Class,"A member of the House of Lords dies in a shockingly silly way, leaving his estate to his son. Unfortunately, his son is insane: he thinks he is Jesus Christ. The other somewhat-more respectable members of their family plot to steal the estate from him. Murder and mayhem ensues.","Drama, Comedy",154.0,1972-09-13,https://flixpatrol.com/runtime/cache/files/posters/g/w350/4TV1qeDMRHwrRudBIMkEF9KHWe4.jpg
5319,2 or 3 Things I Know About Her,The story of a housewife who must work the streets to earn an extra living - and who becomes the starting point for a larger socio-political essay.,"Comedy, Drama",100.0,1967-03-17,https://flixpatrol.com/runtime/cache/files/posters/g/w350/i1gpu7tlXsOVhhRdPIxCNphYJV0.jpg
5349,Bad Moon,"One man's struggle to contain the curse he hides within... and his last-ditch attempt to free himself with the love of family. But when it looks as if he is losing his battle, and endangering all he holds most dear, the family dog, Thor, is the last hope for his family's survival... and the end to his Werewolf curse.",Horror,80.0,1996-11-01,https://flixpatrol.com/runtime/cache/files/posters/g/w350/ivjPm80ZT4MXO1DifALrP0GkOBZ.jpg
5364,Best of the Best 3: No Turning Back,"Tommy Lee (Phillip Rhee) comes to visit his sister and finds that the town is being overrun with members of the Arian brotherhood. These Arian brothers certainly weren't expecting a Taekwondo expert to show up. Tommy and his sister's husband played by Christopher Mcdonald team up to stop the racism. whats better than watching neo-nazis get the crap kicked out of them? when the person kicking the crap out of them is dressed like homie the killer clown, complete with big red shoes and a foam nose. and thats just ONE of the MANY many many many many many cinematic jewels contained within this action packed blessing to the silver screen.this is the best worst martial arts film since sonny chiba's street fighter! you don't believe me? see for yourself namby-pants and check out the best of the best 3. now!!!",Action,90.0,1995-05-17,https://flixpatrol.com/runtime/cache/files/posters/g/w350/iZIgaTii38fOSmUXnKYx1JaLZXx.jpg
5400,Delicatessen,This bizarre surrealistic black comedy takes place in a small fictitious post-apocalyptic town where food is scarce and butcher Clapet has the macabre business of using human flesh to feed his customers. Yet when his daughter falls in love with his next slaughter victim things turn into chaos.,"Comedy, Fantasy",99.0,1991-04-17,https://flixpatrol.com/runtime/cache/files/posters/g/w350/nD4v80ggEmqXFZtaLDSHA2vxZoR.jpg
5418,The Grifters,"A young short-con grifter suffers both injury and the displeasure of reuniting with his criminal mother, all the while dating an unpredictable young lady.","Crime, Drama",110.0,1990-09-14,https://flixpatrol.com/runtime/cache/files/posters/g/w350/uyaZkvfe907W8zH6QonaFjPxJ63.jpg
5419,Hear My Song,"Singer Josef Locke fled to Ireland 25 years ago to escape the clutches of the tax man and police Chief Jim Abbott. What he also left behind was the love of his life Cathleen Doyle. Now, Micky O’Neill is desperate to save both his ailing Liverpool nightclub ‘Heartly’s’ and his failing relationship with the beautiful Nancy, Cathleen’s daughter. The solution? Book the infamous Josef Locke.","Comedy, Foreign",113.0,1991-12-27,https://flixpatrol.com/runtime/cache/files/posters/g/w350/sg0SmGCtFcfWUWnVsOdhDRjCItM.jpg
5445,The English Patient,"Beginning in the 1930s, ""The English Patient"" tells the story of Count Almásy who is a Hungarian map maker employed by the Royal Geographical Society to chart the vast expanses of the Sahara Desert along with several other prominent explorers. As World War II unfolds, Almásy enters into a world of love, betrayal, and politics that is later revealed in a series of flashbacks while Almásy is on his death bed after being horribly burned in a plane crash.","Drama, Romance, War",162.0,1996-11-14,https://flixpatrol.com/runtime/cache/files/posters/g/w350/niqc0v3Lclh99Mmmxm49qZTIo2e.jpg
5449,Mediterraneo,"Greek Sea, World War II. An Italian ship leaves a handful of soldiers in a little island; their mission is to spot enemy ships and to hold the island in case of attack. The village of the island seems abandoned and there isn't a single enemy in sight, so the soldiers begin to relax a little. Things change when their ship is hit and destroyed by the enemy, and the soldiers find themselves abandoned there. Actually, the island isn't deserted and when the Greeks understand that those Italians are harmless, they came out of their hiding places in the mountains and continue their peaceful lives. Soon the soldiers discover that being left behind in a God-forgotten Greek island isn't such a bad thing, after all...","Comedy, Romance, War",96.0,1991-01-31,https://flixpatrol.com/runtime/cache/files/posters/g/w350/zn2nfy87gqCt4uZ7m3Azs16EFRX.jpg
5459,"Sex, Lies, and Videotape",A sexually repressed woman's husband is having an affair with her sister. The arrival of a visitor with a rather unusual fetish changes everything.,Drama,100.0,1989-08-18,https://flixpatrol.com/runtime/cache/files/posters/g/w350/kOXATYKziiKmoMxgKA10JOO13JZ.jpg
5477,The Thin Blue Line,Errol Morris's unique documentary dramatically re-enacts the crime scene and investigation of a police officer's murder in Dallas.,"Mystery, Documentary, Crime",103.0,1988-08-28,https://flixpatrol.com/runtime/cache/files/posters/g/w350/xFN3xPDzN4O7oIBmxnLIh8VROIw.jpg
5481,Madonna: Truth or Dare,"From the rain of Japan, through threats of arrest for 'public indecency' in Canada, and a birthday tribute to her father in Detroit, this documentary follows Madonna on her 1990 'Blond Ambition' concert tour. Filmed in black and white, with the concert pieces in glittering MTV color, it is an intimate look at the work of the music performer, from a prayer circle with the dancers before each performance to bed games with the dance troupe afterwards.","Documentary, Music",119.0,1991-05-10,https://flixpatrol.com/runtime/cache/files/posters/g/w350/gGl1TvzDzrfA5HhRQwvwzW55CXv.jpg
5502,One Flew Over the Cuckoo's Nest,"While serving time for insanity at a state mental hospital, implacable rabble-rouser, Randle Patrick McMurphy inspires his fellow patients to rebel against the authoritarian rule of head nurse, Mildred Ratched.",Drama,133.0,1975-11-18,https://flixpatrol.com/runtime/cache/files/posters/g/w350/2Sns5oMb356JNdBHgBETjIpRYy9.jpg
5507,The Empire Strikes Back,"The epic saga continues as Luke Skywalker, in hopes of defeating the evil Galactic Empire, learns the ways of the Jedi from aging master Yoda. But Darth Vader is more determined than ever to capture Luke. Meanwhile, rebel leader Princess Leia, cocky Han Solo, Chewbacca, and droids C-3PO and R2-D2 are thrown into various stages of capture, betrayal and despair.","Adventure, Action",124.0,1980-05-17,https://flixpatrol.com/runtime/cache/files/posters/g/w350/6u1fYtxG5eqjhtCPDx04pJphQRW.jpg
5508,The Princess Bride,"In this enchantingly cracked fairy tale, the beautiful Princess Buttercup and the dashing Westley must overcome staggering odds to find happiness amid six-fingered swordsmen, murderous princes, Sicilians and rodents of unusual size. But even death can't stop these true lovebirds from triumphing.","Adventure, Family, Fantasy, Comedy, Romance",98.0,1987-09-18,https://flixpatrol.com/runtime/cache/files/posters/g/w350/gpxjoE0yvRwIhFEJgNArtKtaN7S.jpg
5515,Raiders of the Lost Ark,"When Dr. Indiana Jones – the tweed-suited professor who just happens to be a celebrated archaeologist – is hired by the government to locate the legendary Ark of the Covenant, he finds himself up against the entire Nazi regime.","Adventure, Action",115.0,1981-06-12,https://flixpatrol.com/runtime/cache/files/posters/g/w350/44sKJOGP3fTm4QXBcIuqu0RkdP7.jpg
5524,Brazil,"Low-level bureaucrat Sam Lowry escapes the monotony of his day-to-day life through a recurring daydream of himself as a virtuous hero saving a beautiful damsel. Investigating a case that led to the wrongful arrest and eventual death of an innocent man instead of wanted terrorist Harry Tuttle, he meets the woman from his daydream, and in trying to help her gets caught in a web of mistaken identities, mindless bureaucracy and lies.",Comedy,132.0,1985-02-20,https://flixpatrol.com/runtime/cache/files/posters/g/w350/55Vfc1beLn3pJF4Lw83TRKHenK6.jpg
5528,Aliens,"When Ripley's lifepod is found by a salvage crew over 50 years later, she finds that terra-formers are on the very planet they found the alien species. When the company sends a family of colonists out to investigate her story, all contact is lost with the planet and colonists. They enlist Ripley and the colonial marines to return and search for answers.","Horror, Action, Thriller",137.0,1986-07-18,https://flixpatrol.com/runtime/cache/files/posters/g/w350/nORMXEkYEbzkU5WkMWMgRDJwjSZ.jpg
5617,To Kill a Mockingbird,"In a small Alabama town in the 1930s, scrupulously honest and highly respected lawyer, Atticus Finch puts his career on the line when he agrees to represent Tom Robinson, a black man accused of rape. The trial and the events surrounding it are seen through the eyes of Finch's six-year-old daughter, Scout. While Robinson's trial gives the movie its momentum, there are plenty of anecdotal occurrences before and after the court date: Scout's ever-strengthening bond with older brother, Jem, her friendship with precocious young Dill Harris, her father's no-nonsense reactions to such life-and-death crises as a rampaging mad dog, and especially Scout's reactions to, and relationship with, Boo Radley, the reclusive 'village idiot' who turns out to be her salvation when she is attacked by a venomous bigot.","Crime, Drama",129.0,1962-12-25,https://flixpatrol.com/runtime/cache/files/posters/g/w350/gQg6sPYfNTUlf8wEtydzWl09RyR.jpg
