currentId,title,overview,genres,runtime,releaseDate,posterPath
2269,Surviving the Game,Mason is a man down on his luck with nothing to lose when he's approached to lead a group of wealthy hunters on an expedition in the Pacific Northwest. But things get really twisted when Mason discovers the group isn't after wild animals -- they're after him.,"Action, Adventure, Thriller, Crime",96.0,1994-04-15,https://flixpatrol.com/runtime/cache/files/posters/g/w350/8SILtvmd0DCJeBTTWnwO7lur1S7.jpg
2273,Terminal Velocity,A maverick skydiver and a former KGB agent team up to stop the Russian mafia from stealing gold.,"Action, Thriller",102.0,1994-09-23,https://flixpatrol.com/runtime/cache/files/posters/g/w350/iPcXoYCuRu92mQy0wfUCp3wqnmb.jpg
2278,Thirty Two Short Films About Glenn Gould,"A collection of vignettes highlighting different aspects of the life, work, and character of the acclaimed Canadian classical pianist.","Drama, Music",93.0,1993-11-26,https://flixpatrol.com/runtime/cache/files/posters/g/w350/ib8uIrU8QzoegCiKKGcMnUuCzBH.jpg
2282,Threesome,"Eddy and Stuart share two-thirds of a dormitory suite. Due to bureaucratic error, a woman named Alex is added to their room. At first, relations among the three are tense. Soon, however, Alex falls for Eddy, and Stuart lusts after Alex.","Comedy, Drama, Family, Romance",93.0,1994-04-08,https://flixpatrol.com/runtime/cache/files/posters/g/w350/sA5gVzzufDoPtS06ODuQFpVmXnA.jpg
2288,The Nightmare Before Christmas,"Tired of scaring humans every October 31 with the same old bag of tricks, Jack Skellington, the spindly king of Halloween Town, kidnaps Santa Claus and plans to deliver shrunken heads and other ghoulish gifts to children on Christmas morning. But as Christmas approaches, Jack's rag-doll girlfriend, Sally, tries to foil his misguided plans.","Fantasy, Animation, Family",76.0,1993-10-09,https://flixpatrol.com/runtime/cache/files/posters/g/w350/6oxkO1VgKCq74fNILKAg6t2dVEt.jpg
2294,True Romance,"Clarence marries hooker Alabama, steals cocaine from her pimp, and tries to sell it in Hollywood, while the owners of the coke try to reclaim it.","Action, Thriller, Crime, Romance",120.0,1993-09-09,https://flixpatrol.com/runtime/cache/files/posters/g/w350/xBO8R3CZfrJ9rrwrZoJ68PgJyAR.jpg
2313,"The Beans of Egypt, Maine","The Beans are poor, proud, hated by all, but alive in the sense that they struggle against their lot and support each other in time of trouble. Earlene lives across the street from the Bean's trailer, and the view from her window is better than any daytime television soap opera; especially Beal Bean, and especially Beal Bean shirtless. When Reuben Bean is sent to prison for resisting arrest for out-of-season deer hunting, Beal takes up with Reuben's woman Roberta. He also has a child by Earlene, with a triangle of sex complicated by poverty.","Action, Adventure, Crime, Mystery, Thriller",0.0,1994-01-01,https://flixpatrol.com/runtime/cache/files/posters/g/w350/1uRKsxOCtgz0xVqs9l4hYtp4dFm.jpg
2318,Welcome to the Dollhouse,An unattractive 7th grader struggles to cope with suburban life as the middle child with un-attentive parents and bullies at school.,"Comedy, Drama",88.0,1995-05-24,https://flixpatrol.com/runtime/cache/files/posters/g/w350/jvxLLHwpK52ZJUusd2RJv8oLHUJ.jpg
2321,Germinal,"It's mid 19th century, north of France. The story of a coal miner's town. They are exploited by the mine's owner. One day the decide to go on strike, and then the authorities repress them","Drama, Romance",160.0,1993-09-29,https://flixpatrol.com/runtime/cache/files/posters/g/w350/uGDqQAosD7HDD1YZd5sgoSLoNfT.jpg
2324,Chasers,"Military men Rock Reilly and Eddie Devane are tasked with taking a prisoner, blonde bombshell Toni Johnson, on what becomes an unforgettable road trip. Toni, an enlistee who's in trouble for deserting her unit, soon proves that she's craftier than most inmates.","Comedy, Romance",102.0,1994-04-22,https://flixpatrol.com/runtime/cache/files/posters/g/w350/j8Q7pQ27hvH54wpxJzIuQgQCdro.jpg
2329,Cronos,"Faced with his own mortality, an ingenious alchemist tried to perfect an invention that would provide him with the key to eternal life. It was called the Cronos device. When he died more than 400 years later, he took the secrets of this remarkable device to the grave with him. Now, an elderly antiques dealer has found the hellish machine hidden in a statue and learns about its incredible powers. The more he uses the device, the younger he becomes...but nothing comes without a price. Life after death is just the beginning as this nerve-shattering thriller unfolds and the fountain of youth turns bloody.","Drama, Horror, Thriller",94.0,1993-09-12,https://flixpatrol.com/runtime/cache/files/posters/g/w350/6ZgqGgguuKU0Ba2aQOjzikbwnNQ.jpg
2340,Little Big League,"The Chairman of the Minnesota Twins passes away and in his will, leaves his grandson, Billy Heywood, ownership of the team. Billy appoints himself the new manager. But will the proud, arrogant arrogant players of the team, be willing to take orders and tactics from a 12 year old boy?","Comedy, Family",119.0,1994-06-29,https://flixpatrol.com/runtime/cache/files/posters/g/w350/6C3I6GzyB778rlZ13uTJSzTENog.jpg
2351,The Slingshot,"Stocholm in the 1920s. Young Roland lives with his socialist father, Jewish mother and a boxing brother. His mother sells condoms illegally, and from them, Roland makes slingshots which he sells. His rebellious ways has gotten him the special attention of his school teacher, who always makes sure that Roland is punished. Roland also tries to make extra money by repairing bicycles, a successful business that in the end lands him in hot water.",Drama,102.0,1993-09-24,https://flixpatrol.com/runtime/cache/files/posters/g/w350/2ghEU2JcFqHGTNr9h7p17eC3zPA.jpg
2357,"Ciao, Professore!","A bureaucratic snafu sends Marco Tullio Sperelli, a portly, middle-aged northern Italian, to teach third grade in a poor town outside Naples","Comedy, Foreign",100.0,1992-10-01,https://flixpatrol.com/runtime/cache/files/posters/g/w350/l5m4ZAGijWr43am5hWYf1T9cEDo.jpg
2366,The Little Rascals,"Spanky, Alfalfa, Buckwheat, and the other characters made famous in the Our Gang shorts of the 1920s and 1930s are brought back to life in this nostalgic children's comedy. When Alfalfa starts to question his devotion to the club's principles after falling for the beautiful nine-year old Darla, the rest of the gang sets out to keep them apart.","Romance, Comedy, Family",82.0,1994-08-05,https://flixpatrol.com/runtime/cache/files/posters/g/w350/bYpc0diOR3nk9yZeDXEHmsjuKjI.jpg
2371,Andre,"The true story of how a marine seal named Andre befriended a little girl and her family, circa 1962.","Drama, Family, Adventure",94.0,1994-08-17,https://flixpatrol.com/runtime/cache/files/posters/g/w350/dB6aXyLns7nKsxcPAE5Dj40dNSx.jpg
2387,The Celluloid Closet,"This documentary highlights the historical contexts that gays, lesbians, bisexuals and transgenders have occupied in cinema history, and shows the evolution of the entertainment industry's role in shaping perceptions of LGBT figures. The issues addressed include secrecy – which initially defined homosexuality – as well as the demonization of the homosexual community with the advent of AIDS, and finally the shift toward acceptance and positivity in the modern era.","History, Documentary",102.0,1996-01-30,https://flixpatrol.com/runtime/cache/files/posters/g/w350/yu7dybHQPXdmqmW7oPecaICo3Mr.jpg
2405,The Brady Bunch Movie,"The original 70's TV family is now placed in the 1990's, where they're even more square and out of place than ever.",Comedy,84.0,1995-02-16,https://flixpatrol.com/runtime/cache/files/posters/g/w350/zqUFRgbHec3zEMI8jqzau5jYn8Z.jpg
2406,Home Alone,"Eight-year-old Kevin McCallister makes the most of the situation after his family unwittingly leaves him behind when they go on Christmas vacation. But when a pair of bungling burglars set their sights on Kevin's house, the plucky kid stands ready to defend his territory. By planting booby traps galore, adorably mischievous Kevin stands his ground as his frantic mother attempts to race home before.","Comedy, Family",103.0,1990-11-09,https://flixpatrol.com/runtime/cache/files/posters/g/w350/8IWPBT1rkAaI8Kpk5V3WfQRklJ7.jpg
2407,Terminator 2: Judgment Day,"Nearly 10 years have passed since Sarah Connor was targeted for termination by a cyborg from the future. Now her son, John, the future leader of the resistance, is the target for a newer, more deadly terminator. Once again, the resistance has managed to send a protector back to attempt to save John and his mother Sarah.","Action, Thriller",137.0,1991-07-01,https://flixpatrol.com/runtime/cache/files/posters/g/w350/2y4dmgWYRMYXdD1UyJVcn2HSd1D.jpg
2413,Dances with Wolves,"Wounded Civil War soldier, John Dunbar tries to commit suicide – and becomes a hero instead. As a reward, he's assigned to his dream post, a remote junction on the Western frontier, and soon makes unlikely friends with the local Sioux tribe.","Adventure, Drama, Western",181.0,1990-11-09,https://flixpatrol.com/runtime/cache/files/posters/g/w350/hpmclspug1I8EwKSWhL7pWWltA.jpg
2427,The Silence of the Lambs,"FBI trainee, Clarice Starling ventures into a maximum-security asylum to pick the diseased brain of Hannibal Lecter, a psychiatrist turned homicidal cannibal. Starling needs clues to help her capture a serial killer. but her Faustian relationship with Lecter soon leads to his escape, and now two deranged killers are on the loose.","Crime, Drama, Thriller",119.0,1991-02-01,https://flixpatrol.com/runtime/cache/files/posters/g/w350/qjAyTj2BSth1EQ89vNfo0JYVPFN.jpg
2428,Snow White and the Seven Dwarfs,"A beautiful girl, Snow White, takes refuge in the forest in the house of seven dwarfs to hide from her stepmother, the wicked Queen. The Queen is jealous because she wants to be known as ""the fairest in the land,"" and Snow White's beauty surpasses her own.","Fantasy, Animation, Family",83.0,1937-12-20,https://flixpatrol.com/runtime/cache/files/posters/g/w350/wbVGRBYPRRahIZNGXY9TfHDUSc2.jpg
2439,Pretty Woman,"When millionaire wheeler-dealer Edward Lewis enters a business contract with Hollywood hooker Vivian Ward, he loses his heart in the bargain in this charming romantic comedy. After Edward hires Vivian as his date for a week and gives her a Cinderella makeover, she returns the favor by mellowing the hardnosed tycoon's outlook. Can the poor prostitute and the rich capitalist live happily ever after?","Romance, Comedy",119.0,1990-03-23,https://flixpatrol.com/runtime/cache/files/posters/g/w350/fgmdaCMxXClZm2ePteLzCPySB1n.jpg
2447,Window to Paris,"Nikolai (played by Sergei Dontsov) has been fired from his job as a music teacher and has to live in the gym until he finds a place to stay. Finally, he gets a communal room in the apartment of Gorokhov (Victor Mikhalkov). The room's previous inhabitant, an old lady, has died a year ago, and yet her cat, Maxi, is still in the locked room, healthy and fat. Soon, Nikolai and his neighbours discover the mystery: there is a window to Paris in the room. That's when the comedy begins - will the Russians be able to cope with the temptation to profit from the discovery?","Comedy, Drama, Fantasy",87.0,1993-12-01,https://flixpatrol.com/runtime/cache/files/posters/g/w350/m91eOM6qDDVrUkBjuWHeZsPBOPD.jpg
2541,Homeward Bound II: Lost in San Francisco,"Your favorite talking animals are back! The film focuses on the further adventures of Shadow (voiced by Ralph Waite), Sassy (voiced by Sally Field), and Chance (voiced by Michael J. Fox). Shadow is the old, wise one and presumably the leader of the three. Sassy is the smart-aleck of the bunch, but helpful in times as well. Chance is the young, anxious one who usually gets into trouble and relies o","Adventure, Comedy, Drama, Family",89.0,1996-03-08,https://flixpatrol.com/runtime/cache/files/posters/g/w350/6oFXtbLt9IyoK6rdvdt0ccF6hGP.jpg
2542,Heavy Metal,"A glowing orb terrorizes a young girl with a collection of stories of dark fantasy, eroticism and horror.",Animation,90.0,1981-08-07,https://flixpatrol.com/runtime/cache/files/posters/g/w350/aWDqK6EhzTRKE7WvZE737Fbeo9D.jpg
2568,The Pallbearer,"Aspiring architect Tom Thompson is told by mysterious Ruth Abernathy that his best friend, ""Bill,"" has taken his own life. Except that Tom has never met Bill and neither have his incredulous friends. So when Tom foolishly agrees to give the eulogy at Bill's funeral, it sets him on a collision course with Ruth -- who is revealed to be Bill's oversexed mother -- and Julie DeMarco, the longtime crush Tom hasn't seen since they were teens.","Comedy, Romance",97.0,1996-05-03,https://flixpatrol.com/runtime/cache/files/posters/g/w350/zbgaHONbpNYrpBVdmKcj2MyTHtI.jpg
2580,Scream of Stone,"A meeting of two world famous climbers, one an experienced mountaineer the other a sport climber, and a journalist (Ivan) results in a bet on which of the two is the best climber. Roger (the mountaineering expert) states that Martin (the sport climber) wouldn't survive a day on a 'real' climbing expedition, although he is considered to be the world's best sport climber (having just won an indoor 'world championship,' an event depicted in the opening scene). They plan to climb 'Cerro Torre,' in the Patagonia region of South America, near the Argentinian/Chilean border, one of the world's most difficult mountains, especially considering the extreme weather conditions common to the area.","Adventure, Drama, Documentary",105.0,1991-01-01,https://flixpatrol.com/runtime/cache/files/posters/g/w350/459MeLTQMF9hlNvaHbUuBPIo5I6.jpg
2581,My Favorite Season,"Old woman Berthe leaves her house to live in her daugter Emilie's one. Emilie and her brother Antoine have fallen out three years ago and have not seen each other since, but Emilie invites him for Christmas. Memories will come up, and will be depicted both Berthe's destiny and the strange relationship between Emilie and Antoine.",Drama,127.0,1993-05-14,https://flixpatrol.com/runtime/cache/files/posters/g/w350/hmb9Iu6jzvV8jrIz4z73ZRWP91s.jpg
2600,The Last Supper,"A group of idealistic, but frustrated, liberals succumb to the temptation of murdering rightwing pundits for their political beliefs.","Comedy, Thriller, Crime, Drama",92.0,1995-09-08,https://flixpatrol.com/runtime/cache/files/posters/g/w350/7H68q5zKJBhrjKmsXSGfaCmkkmU.jpg
2624,Carried Away,"Based on Jim Harrison's book, ""Farmer"". 47-year-old Joseph Svenden lives on the family farm with his dying mother and teaches at a two room schoolhouse with Rosealee, his lover and his best friend's widow. Joseph, who lacks a college degree, learns that he will lose his teaching job at the end of the year when the school district expands into his town. Meanwhile, he is seduced by 17-year-old Catherine, a new student in his class. His affair with Catherine and losing his teaching job forces Joseph to take a look at his previously dull life and to decide how he wants to live the rest of it.","Drama, Romance",109.0,1996-01-26,https://flixpatrol.com/runtime/cache/files/posters/g/w350/5O8xOTiyROkAeuPLVV2dO0eo28R.jpg
2628,All Dogs Go to Heaven 2,"Charlie and Itchy return to Earth to find Gabriel's Horn, but along the way meet up with a young boy named David, who ran away from home.","Romance, Animation, Family, Adventure, Fantasy",82.0,1996-03-29,https://flixpatrol.com/runtime/cache/files/posters/g/w350/4JClwkSL1L64bkExyuShmm8zHLR.jpg
2640,Land and Freedom,"The movie narrates the story of David Carr, an unemployed worker and member of the Communist Party of Great Britain. In 1936 he decides to fight for the Republican side in the Spanish Civil War, an anti-fascist coalition of liberals, communists and anarchists. Similar to George Orwell's experiences documented in Homage to Catalonia, he joins the POUM worker militia and witnesses first hand the betrayal of the Spanish revolution by the Stalinists, loyal only to the dictat of Moscow.","Drama, History, War, Romance",109.0,1995-01-01,https://flixpatrol.com/runtime/cache/files/posters/g/w350/6pBxruRCygxR4AcmilYr8YIe0a9.jpg
2683,Sgt. Bilko,The army is known for churning out lean mean fighting machines intent on protecting our great nation. Martin is the inexplicable the incorrigible the invicible sgt. Ernie bilko leader of a ragtag group of the sorriest soldiers ever to enlist in the armed forces.,"Comedy, Family",90.0,1996-03-29,https://flixpatrol.com/runtime/cache/files/posters/g/w350/lP9i3lzCwz8mu8ynuzJJBu4Sa9u.jpg
2692,Girl 6,"Girl 6 is a 1996 American film by director Spike Lee about a phone sex operator. Theresa Randle played the title character, and playwright Suzan-Lori Parks wrote the screenplay. The soundtrack is composed entirely of songs written by Prince. The film was screened in the Un Certain Regard section at the 1996 Cannes Film Festival. Directors Quentin Tarantino and Ron Silver make cameo appearances as film directors at a pair of interesting auditions.",Comedy,108.0,1996-03-22,https://flixpatrol.com/runtime/cache/files/posters/g/w350/iy0w5k8icgoBpbTi9JLqUiTSeCU.jpg
2699,"Little Indian, Big City","Stephen, an international trader, tracks down his ex-wife Patricia in some Amazonian backwater. He needs her consent to a divorce so that he can marry Charlotte. Unfortunately, he discovers a son he didn’t know he had – Mimi-Siku. The young jungle boy yearns to see Paris so Stephen reluctantly agrees to take him back home with him for a few days. How will Mimi-Siku react to life in the great metropolis?","Adventure, Drama, Comedy, Family",90.0,1994-12-14,https://flixpatrol.com/runtime/cache/files/posters/g/w350/y6gnqDDPPtGZomkkqWVc4wWM7wX.jpg
2702,Happy Weekend,"Harassed by classmates who won't accept his shocking appearance, a shy young man known as ""Powder"" struggles to fit in. But the cruel taunts stop when Powder displays a mysterious power that allows him to do incredible things. This phenomenon changes the lives of all those around him in ways they never could have imagined.",Comedy,111.0,1996-03-14,https://flixpatrol.com/runtime/cache/files/posters/g/w350/1uRKsxOCtgz0xVqs9l4hYtp4dFm.jpg
2706,Nelly and Monsieur Arnaud,"Nelly leaves her lazy, unemployed husband to work for retired judge Mr Arnaud, forty years her senior, after he offers to clear her bills for her. While she types his memoirs the two develop a close friendship, but Arnaud becomes jealous when Nelly begins dating his good-looking young publisher.","Drama, Romance",106.0,1996-04-12,https://flixpatrol.com/runtime/cache/files/posters/g/w350/vtQl8XRlR0YRAHSZvBweMeePrVu.jpg
2707,Courage Under Fire,"A US Army officer had made a ""friendly fire"" mistake that was covered up and he was reassigned to a desk job. Later he was tasked to investigate a female chopper commander's worthiness to be awarded the Medal of Honor posthumously. At first all seemed in order then he begins to notice inconsistencies between the testimonies of the witnesses....","Drama, Thriller, Mystery, War",117.0,1996-07-04,https://flixpatrol.com/runtime/cache/files/posters/g/w350/lPAzGRgc2afaGsYwFX7Iez8gzmq.jpg
2712,Moll Flanders,"The daughter of a thief, young Moll is placed in the care of a nunnery after the execution of her mother. However, the actions of an abusive priest lead Moll to rebel as a teenager, escaping to the dangerous streets of London. Further misfortunes drive her to accept a job as a prostitute from the conniving Mrs. Allworthy. It is there that Moll first meets Hibble, who is working as Allworthy's servant but takes a special interest in the young woman's well-being. With his help, she retains hope for the future, ultimately falling in love with an unconventional artist who promises the possibility of romantic happiness.","Drama, Romance",123.0,1996-06-14,https://flixpatrol.com/runtime/cache/files/posters/g/w350/xR1Whba2hyUpKCa0FE18hVCG9jb.jpg
2718,Und keiner weint mir nach,"Harassed by classmates who won't accept his shocking appearance, a shy young man known as ""Powder"" struggles to fit in. But the cruel taunts stop when Powder displays a mysterious power that allows him to do incredible things. This phenomenon changes the lives of all those around him in ways they never could have imagined.",Drama,111.0,1996-02-29,https://flixpatrol.com/runtime/cache/files/posters/g/w350/1uRKsxOCtgz0xVqs9l4hYtp4dFm.jpg
2722,My Mother's Courage,"The deportation of 4000 Jews from Budapest to Auschwitz in July 1944, as told by George Tabori, and how the narrator's mother escaped it, owing to coincidence, courage and some help from where you'd least expect it.",Drama,93.0,1995-09-12,https://flixpatrol.com/runtime/cache/files/posters/g/w350/xxhP6gUVA6lcHuv0CpOyRixnuPY.jpg
2723,Eddie,"Eddie is a New York limo driver and a fanatical follower of the New York Knicks professional basketball team. The team is struggling with a mediocre record when, in mid-season, ""Wild Bill"" Burgess, the new owner, as a public relations gimmick, stages an 'honorary coach' contest, which Eddie wins. The fans love it, so ""Wild Bill"" fires the coach and hires her. She takes the bunch of overpaid prima","Action, Comedy",100.0,1996-05-31,https://flixpatrol.com/runtime/cache/files/posters/g/w350/xl4WRePyVL9GYEnGmOSKbU0Hd8g.jpg
2761,James and the Giant Peach,"When the young orphan boy James spills a magic bag of crocodile tongues, he finds himself in possession of a giant peach that flies him away to strange lands.","Adventure, Animation, Family",79.0,1996-04-12,https://flixpatrol.com/runtime/cache/files/posters/g/w350/fDfgO1jkPAIX9ZbXka9XcOfDWl3.jpg
2769,All Things Fair,This film is set in 1943 when the whole of Europe was embroiled in WWII. It deals with attraction of a 15 year old boy Stig to his teacher Viola. The whole movie revolves around the sexual encounters between Stig and Viola and how he eventually grows out of it.,"War, Drama, Romance",130.0,1995-03-08,https://flixpatrol.com/runtime/cache/files/posters/g/w350/uJD0PvYGAa1IoZBsX4E6GQ4K2In.jpg
2819,Space Jam,"In a desperate attempt to win a basketball match and earn their freedom, the Looney Tunes seek the aid of retired basketball champion, Michael Jordan.","Animation, Comedy, Drama, Family, Fantasy",88.0,1996-11-15,https://flixpatrol.com/runtime/cache/files/posters/g/w350/bJhVLribUKCrKv1h1WFqv4QmRWM.jpg
2840,Barbarella,"In the far future, a highly sexual woman is tasked with finding and stopping the evil Durand-Durand. Along the way she encounters various unusual people.",Science Fiction,98.0,1968-10-10,https://flixpatrol.com/runtime/cache/files/posters/g/w350/fntrx2BzHkdSNFe5jkgP09XsK7g.jpg
2918,Country Life,"Adaptation of Chekhov's ""Uncle Vanya"" set in rural Australia in the 1920s. Jack Dickens and his niece Sally run the family farm to support brother-in-law Alexander as a (supposedly brilliant) literary critic in London. Action begins when Alexander returns with his beautiful young wife Deborah, revealing himself as an arrogant failure and wanting to sell the farm out from under Jack. Blakemore introduces themes about Australia's separation from England, as well as expanding the pacifist and ecological philosophies espoused by the local Doctor Max Askey.","Drama, Romance",118.0,1994-10-27,https://flixpatrol.com/runtime/cache/files/posters/g/w350/s961qNIvQYGbHc7NbgqmFBocL4U.jpg
2947,Mrs. Winterbourne,"Connie Doyle is eighteen and pregnant her boyfriend has kicked her out. She accidentaly ends up on a train where she meets Hugh Winterbourne and his wife Patricia who is pregnant. The train wrecks and she wakes up in the hosptial to find out that it's been assumed that she's Patricia. Hugh's mother takes her in and she falls in love with Hugh's brother Bill. Just when she thinks everything is going her way, her ex-boyfriend shows up.","Comedy, Romance, Drama",105.0,1996-04-19,https://flixpatrol.com/runtime/cache/files/posters/g/w350/4XNWsXCv7vY04RzxyUrN7zWHlxU.jpg
2952,Feeling Minnesota,"Sam Clayton's (Vincent D'Onofrio) marriage to ex-stripper Freddie (Cameron Diaz) comes about when she's strong-armed into the match by Red (Delroy Lindo), a club proprietor who once did her a favor. But Freddie falls in love with Jiaks (Keanu Reeves), Sam's brother, and the pair tries to escape the situation together. It isn't long before both Sam and Red catch up with them, resulting in threats against the two of them -- although tension also starts to build between Sam and Red.","Action, Comedy, Drama, Thriller",99.0,1996-09-13,https://flixpatrol.com/runtime/cache/files/posters/g/w350/t7s9kxuSXnf3GwpK2dMzwv4Xcnn.jpg
2976,Angus,"Angus is a large, pathetic 14 year old whose thoughts are most often filled with the image of one Melissa Lefevre. Angus is shy and thinks that he has no chance of ever 'getting' her. Being especially uncool, he is incredibly surprised (along with the rest of the school) that he is chosen to dance with her at the Winter Ball. The only one not surprised is the cool-kid who set him up to fail, but Angus' best friend is going to help him win the heart of Melissa by developing a new look for him","Comedy, Drama, Family, Romance",90.0,1995-09-15,https://flixpatrol.com/runtime/cache/files/posters/g/w350/71HAhRaGJmFQGwuvx6FOr8YO9NH.jpg
